{
  "doc_type": "新闻稿",
  "doc_type_confidence": 0.92,
  "direction": "对外宣传",
  "style_level": 3,
  "risk_level": "low",
  "reason": "用户明确要求整理为新闻稿，素材包含活动时间、参与团队、获奖作品等新闻事实，适合对外传播，符合新闻稿特征。",
  "required_rules": [
    "新闻稿"
  ],
  "required_structure": [
    "标题",
    "导语",
    "事件主体",
    "主要内容",
    "意义价值",
    "结尾"
  ],
  "forbidden_items": [
    "不得编造领导出席",
    "不得编造领导评价",
    "不得编造成果数据",
    "不得将内部通知写成新闻传播稿"
  ],
  "possible_confusions": [
    {
      "candidate": "会议纪要",
      "reason": "若重点在于记录比赛的组织细节和责任分工，而非活动传播，则可能为会议纪要。",
      "distinguish_rule": "是否用于对外传播塑造品牌形象。"
    }
  ],
  "need_manual_confirmation": false,
  "manual_confirmation_fields": []
}