{
  "doc_type": "领导讲话",
  "doc_type_confidence": 0.92,
  "direction": "综合材料",
  "target_unit": "",
  "scene": "内部会议",
  "style_level": 2,
  "risk_level": "medium",
  "reason": "用户明确要求起草在年度总结会上的讲话提纲，指定文种为领导讲话，初稿内容围绕年度总结与展望，符合领导讲话文种特征。",
  "required_rules": [
    "领导讲话"
  ],
  "required_structure": [
    "开场与背景",
    "形势判断",
    "工作肯定",
    "重点部署",
    "具体要求",
    "结尾号召"
  ],
  "forbidden_items": [
    "不得写成普通新闻稿",
    "不得编造领导个人表态",
    "不得新增未经提供的政策判断",
    "不得使用与领导身份不匹配的口语表达"
  ],
  "possible_confusions": [
    {
      "candidate": "总结",
      "reason": "若内容侧重于罗列工作成效而非领导部署要求，则可能误判为总结。",
      "distinguish_rule": "是否以领导第一人称或领导讲话结构展开，是否有号召性结尾和工作部署。"
    }
  ],
  "user_specified_doc_type": "领导讲话",
  "conflict_detected": false,
  "conflict_reason": null,
  "recommended_action": null,
  "need_manual_confirmation": false,
  "manual_confirmation_fields": []
}