{
  "doc_type": "新闻稿",
  "doc_type_confidence": 0.92,
  "direction": "对外宣传",
  "style_level": 3,
  "risk_level": "low",
  "reason": "用户明确要求新闻稿，素材包含活动时间、地点、参赛团队和获奖作品等新闻事实，符合新闻稿特征。",
  "required_rules": [
    "新闻稿"
  ],
  "required_structure": [
    "标题",
    "导语",
    "事件主体",
    "主要内容",
    "意义价值",
    "结尾"
  ],
  "forbidden_items": [
    "不得编造领导出席",
    "不得编造领导评价",
    "不得编造成果数据",
    "不得将内部通知写成新闻传播稿"
  ],
  "possible_confusions": [
    {
      "candidate": "通知",
      "reason": "若目的是布置工作或要求报送材料，则可能是通知。",
      "distinguish_rule": "是否对外传播活动成果。"
    }
  ],
  "need_manual_confirmation": false,
  "manual_confirmation_fields": []
}